{
  "schema_version": 1,
  "id": "target",
  "description": "Confirmed personal target; all KEEP capabilities including selected GPU feature. Delivery readiness is independent of selection.",
  "capability_ids": [
    "actionlint",
    "age",
    "ansible-core",
    "ansible-lint",
    "argocd",
    "atuin",
    "aws-cli",
    "azure-cli",
    "backup-workflow",
    "baobab",
    "bat",
    "bitwarden",
    "browser-isolation",
    "btop",
    "chezmoi",
    "claude-code",
    "cline",
    "cloud-init",
    "codex",
    "container-substrate",
    "containerd",
    "controller-python",
    "curl",
    "dbeaver",
    "dconf-editor",
    "deja-dup",
    "delta",
    "direnv",
    "dive",
    "docker-buildx",
    "docker-compose",
    "docker-credentials",
    "docker-engine",
    "editor-settings",
    "extension-anthropic.claude-code",
    "extension-dbaeumer.vscode-eslint",
    "extension-eamodio.gitlens",
    "extension-esbenp.prettier-vscode",
    "extension-golang.go",
    "extension-ms-azuretools.vscode-docker",
    "extension-ms-kubernetes-tools.vscode-kubernetes-tools",
    "extension-ms-python.python",
    "extension-ms-toolsai.jupyter",
    "extension-ms-vscode-remote.remote-containers",
    "extension-ms-vscode-remote.remote-ssh",
    "extension-ms-vscode.makefile-tools",
    "extension-openai.chatgpt",
    "extension-redhat.vscode-xml",
    "extension-redhat.vscode-yaml",
    "extension-saoudrizwan.claude-dev",
    "extension-vscode-icons-team.vscode-icons",
    "eza",
    "fd",
    "ffmpeg",
    "firefox",
    "flameshot",
    "font-inconsolata",
    "font-jetbrains-mono-nerd",
    "font-powerline",
    "fzf",
    "gedit",
    "gh",
    "ghostty",
    "git",
    "git-identity",
    "git-lfs",
    "git-lfs-filters",
    "git-signing",
    "gitleaks",
    "gnome-disks",
    "gnome-extension-manager",
    "gnome-settings",
    "gnome-text-editor",
    "gnupg",
    "google-chrome",
    "gparted",
    "gradle",
    "hadolint",
    "helm",
    "helmfile",
    "host-security",
    "htop",
    "httpie",
    "identity-restoration",
    "java",
    "jq",
    "just",
    "k3d",
    "k9s",
    "kind",
    "kotlin",
    "krew",
    "krew-images",
    "krew-neat",
    "krew-sniff",
    "krew-tree",
    "krew-view-secret",
    "krew-whoami",
    "kubeconform",
    "kubectl",
    "kubectx",
    "kubeseal",
    "kustomize",
    "lab-isolation",
    "libreoffice",
    "libvirt",
    "local-history",
    "mandrel",
    "maven",
    "mcedit",
    "meld",
    "midnight-commander",
    "neovim",
    "net-tools",
    "networkmanager-openvpn",
    "node",
    "nvidia-container-toolkit",
    "nvidia-driver",
    "nvm",
    "nvtop",
    "obs-studio",
    "obsidian",
    "oh-my-zsh",
    "opencode",
    "opentofu",
    "openvpn",
    "plan-verify-update",
    "pnpm",
    "privacy-optouts",
    "pytest",
    "python",
    "qemu",
    "rclone",
    "remmina",
    "resources",
    "restic",
    "rhythmbox",
    "ripgrep",
    "scanner-utilities",
    "sdkman",
    "shell-integration",
    "shellcheck",
    "shfmt",
    "shotwell",
    "showtime",
    "skopeo",
    "slack",
    "sops",
    "starship",
    "stern",
    "storage-handoff",
    "terraform-docs",
    "terragrunt",
    "tmux",
    "transmission",
    "trivy",
    "uv",
    "vim",
    "virt-manager",
    "vm-testing",
    "vscode",
    "wget",
    "yamllint",
    "yq",
    "zed",
    "zoxide",
    "zsh",
    "zsh-autosuggestions",
    "zsh-syntax-highlighting"
  ]
}
